Event Index,UTC Timestamp,UTC Date and Time,Local Timestamp,Local Timezone,Local Date and Time,Experiment ID,Experiment Version,Tree Node Key,Repeat Key,Schedule ID,Participant Public ID,Participant Private ID,Participant Starting Group,Participant Status,Participant Completion Code,Participant External Session ID,Participant Device Type,Participant Device,Participant OS,Participant Browser,Participant Monitor Size,Participant Viewport Size,Checkpoint,Room ID,Room Order,Task Name,Task Version,randomiser-3edb,checkpoint-sudm,branch-hm4e,Spreadsheet,Current Spreadsheet,Trial Number,Display,Screen,Screen ID,Screen Counter,Response Type,Response,Onset Time,Clock Time,Reaction Time,Absolute Onset Time,Absolute Clock Time,Absolute Reaction Time,Correct,Response Onset,Response Duration,Proportion,Tag,Component Name,Object Name,Object Number,Object ID,Spreadsheet: display,Spreadsheet: instruct_num,Spreadsheet: instruct_text,Spreadsheet: passage,Spreadsheet: line,Spreadsheet: line_text,Spreadsheet: probe,Spreadsheet: condition,Spreadsheet: condition_num,Spreadsheet: set,Spreadsheet: question_text,Spreadsheet: correct_response,Spreadsheet: response_a,Spreadsheet: response_b,Spreadsheet: response_c,Spreadsheet: response_d,Spreadsheet: response_e,Spreadsheet: ,Spreadsheet: __EMPTY,Spreadsheet: __EMPTY_1,Spreadsheet: __EMPTY_2,Manipulation: Spreadsheet
1,1716654818317,25/05/2024 16:33:38,1716658418317,1,25/05/2024 18:33:38,179131,9,task-353c,,37857916,,11148998,,complete,,,computer,Desktop or Laptop,Windows 10,Edge 125.0.0.0,1536x864,1528x742,Consent,,0,Mind wandering task,11,Set2,Consent,Over 18,set2,set2,,,,,,info,BEGIN,,,,,,,0,,,,,,,,,,,,,,,,,,,,,,,,,,,,,,
2,1716654819872,25/05/2024 16:33:39,1716658419872,1,25/05/2024 18:33:39,179131,9,task-353c,,37857916,,11148998,,complete,,,computer,Desktop or Laptop,Windows 10,Edge 125.0.0.0,1536x864,1528x742,Consent,,0,Mind wandering task,11,Set2,Consent,Over 18,set2,set2,1,start,Welcome,vo3k26,1,continue,,1575.4439999046326,1566.444,1575.4439999046326,1575.4439999046326,1566.444,1575.4439999046326,1,1575.4439999046326,0,0,,Click To Continue,Continue Button,2,object-14,start,,,,,,,,,,,,,,,,,,,,,
3,1716654820969,25/05/2024 16:33:40,1716658420969,1,25/05/2024 18:33:40,179131,9,task-353c,,37857916,,11148998,,complete,,,computer,Desktop or Laptop,Windows 10,Edge 125.0.0.0,1536x864,1528x742,Consent,,0,Mind wandering task,11,Set2,Consent,Over 18,set2,set2,1,instr_passages,Text,zppu2h,1,response,space,1105.9999999046327,1100.2000000000003,1105.9999999046327,1105.9999999046327,1100.2000000000003,1105.9999999046327,1,1105.9999999046327,0,0,,Keyboard Response,Keyboard Response,2,object-25,instr_passages,1,"TASK INSTRUCTIONS - PLEASE READ CAREFULLY! The goal of this study is to learn how mind wandering and OCD symptomology affects how you learn information during reading. <br><br> Mind wandering is a term used to describe what occurs when your attention wanders from a task. Sometimes when your mind wanders, you begin thinking about personal events or concerns rather than your task. At other times, your mind can wander because you are bored or tired and you don’t really know what you’re thinking about; all you know is that you are no longer thinking about your task.<br><br>Please press the space bar to continue.",,,,,,,,,,,,,,,,,,,
4,1716654821349,25/05/2024 16:33:41,1716658421349,1,25/05/2024 18:33:41,179131,9,task-353c,,37857916,,11148998,,complete,,,computer,Desktop or Laptop,Windows 10,Edge 125.0.0.0,1536x864,1528x742,Consent,,0,Mind wandering task,11,Set2,Consent,Over 18,set2,set2,2,instr_passages,Text,zppu2h,1,response,space,386.2999999046324,383.39999999999964,386.2999999046324,386.2999999046324,383.39999999999964,386.2999999046324,1,386.2999999046324,0,0,,Keyboard Response,Keyboard Response,2,object-25,instr_passages,2,"Importantly, mind wandering can occur either because you INTENTIONALLY decided to think about things that are unrelated to the task, OR because your thoughts UNINTENTIONALLY drifted away to task-unrelated thoughts, despite your best intentions to focus on the task. <br><br> Please press the space bar to continue.",,,,,,,,,,,,,,,,,,,
5,1716654821729,25/05/2024 16:33:41,1716658421729,1,25/05/2024 18:33:41,179131,9,task-353c,,37857916,,11148998,,complete,,,computer,Desktop or Laptop,Windows 10,Edge 125.0.0.0,1536x864,1528x742,Consent,,0,Mind wandering task,11,Set2,Consent,Over 18,set2,set2,3,instr_passages,Text,zppu2h,1,response,space,382.59999995231647,366.90000000000055,382.59999995231647,382.59999995231647,366.90000000000055,382.59999995231647,1,382.59999995231647,0,0,,Keyboard Response,Keyboard Response,2,object-25,instr_passages,3,"Being ON TASK means that you were focused on completing the task and were not thinking about anything unrelated to the task. Some examples of ON TASK thoughts include thoughts about your performance on the task, thoughts about the digits, or thoughts about your response. <br><br> Please press the space bar to continue.",,,,,,,,,,,,,,,,,,,
6,1716654822174,25/05/2024 16:33:42,1716658422174,1,25/05/2024 18:33:42,179131,9,task-353c,,37857916,,11148998,,complete,,,computer,Desktop or Laptop,Windows 10,Edge 125.0.0.0,1536x864,1528x742,Consent,,0,Mind wandering task,11,Set2,Consent,Over 18,set2,set2,4,instr_passages,Text,zppu2h,1,response,space,460.7999999761578,450.09999999999945,460.7999999761578,460.7999999761578,450.09999999999945,460.7999999761578,1,460.7999999761578,0,0,,Keyboard Response,Keyboard Response,2,object-25,instr_passages,4,"In this task, you will read 8 passages and answer reading comprehension questions for each passage. <br><br> THE PASSAGES WILL BE PRESENTED IN A SENTENCE-BY-SENTENCE FASHION. PLEASE READ THE SENTENCES AT YOUR NORMAL READING PACE. ONCE YOU HAVE FINISHED READING ONE SENTENCE, PRESS THE SPACE BAR TO MOVE ON TO THE NEXT SENTENCE. Once you've read the sentence you MAY NOT GO BACK.<br><br> Please press the space bar to continue.",,,,,,,,,,,,,,,,,,,
7,1716654822628,25/05/2024 16:33:42,1716658422628,1,25/05/2024 18:33:42,179131,9,task-353c,,37857916,,11148998,,complete,,,computer,Desktop or Laptop,Windows 10,Edge 125.0.0.0,1536x864,1528x742,Consent,,0,Mind wandering task,11,Set2,Consent,Over 18,set2,set2,5,instr_passages,Text,zppu2h,1,response,space,464.6999999761583,449.5,464.6999999761583,464.6999999761583,449.5,464.6999999761583,1,464.6999999761583,0,0,,Keyboard Response,Keyboard Response,2,object-25,instr_passages,5,"THE SET OF READING COMPREHENSION QUESTIONS FOR THAT PARTICULAR PASSAGE YOU’VE FINISHED READING WILL APPEAR AFTER EACH PASSAGE, not all together at the end. Like the sentences, once you've answered the questions you MAY NOT GO BACK TO CHANGE YOUR ANSWER.
<br><br> 
Please press the space bar to continue.",,,,,,,,,,,,,,,,,,,
8,1716654823032,25/05/2024 16:33:43,1716658423032,1,25/05/2024 18:33:43,179131,9,task-353c,,37857916,,11148998,,complete,,,computer,Desktop or Laptop,Windows 10,Edge 125.0.0.0,1536x864,1528x742,Consent,,0,Mind wandering task,11,Set2,Consent,Over 18,set2,set2,6,instr_passages,Text,zppu2h,1,response,space,419.3000000000002,416.90000000000055,419.3000000000002,419.3000000000002,416.90000000000055,419.3000000000002,1,419.3000000000002,0,0,,Keyboard Response,Keyboard Response,2,object-25,instr_passages,6,"Additionally, while you are reading you will be randomly interrupted and asked “WHICH OF THE FOLLOWING RESPONSES BEST CHARACTERISES YOUR MENTAL STATE JUST PRIOR TO THE PRESENTATION OF THIS SCREEN?"" You would have to choose either “On task”, ""Intentionally mind wandering"" or ""Unintentionally mind wandering"" by clicking on the appropriate option.<br><br> Please press the space bar to continue.",,,,,,,,,,,,,,,,,,,
9,1716654823452,25/05/2024 16:33:43,1716658423452,1,25/05/2024 18:33:43,179131,9,task-353c,,37857916,,11148998,,complete,,,computer,Desktop or Laptop,Windows 10,Edge 125.0.0.0,1536x864,1528x742,Consent,,0,Mind wandering task,11,Set2,Consent,Over 18,set2,set2,7,instr_passages,Text,zppu2h,1,response,space,422.4999999046322,416.59999999999945,422.4999999046322,422.4999999046322,416.59999999999945,422.4999999046322,1,422.4999999046322,0,0,,Keyboard Response,Keyboard Response,2,object-25,instr_passages,7,This entire task is self-paced. Though of course you should try NOT TO go over the task's ending time of 30 minutes. So try to do the task all the way through instead of taking too many small breaks in between. The task isn't long so you should be able to do it without taking any breaks. <br><br> Please press the space bar to continue.,,,,,,,,,,,,,,,,,,,
10,1716654823858,25/05/2024 16:33:43,1716658423858,1,25/05/2024 18:33:43,179131,9,task-353c,,37857916,,11148998,,complete,,,computer,Desktop or Laptop,Windows 10,Edge 125.0.0.0,1536x864,1528x742,Consent,,0,Mind wandering task,11,Set2,Consent,Over 18,set2,set2,8,instr_passages,Text,zppu2h,1,response,space,411.39999990463275,400.3000000000002,411.39999990463275,411.39999990463275,400.3000000000002,411.39999990463275,1,411.39999990463275,0,0,,Keyboard Response,Keyboard Response,2,object-25,instr_passages,8,Please press the space bar to start reading the first passage.,,,,,,,,,,,,,,,,,,,
11,1716654824319,25/05/2024 16:33:44,1716658424319,1,25/05/2024 18:33:44,179131,9,task-353c,,37857916,,11148998,,complete,,,computer,Desktop or Laptop,Windows 10,Edge 125.0.0.0,1536x864,1528x742,Consent,,0,Mind wandering task,11,Set2,Consent,Over 18,set2,set2,1,passages,Sentences,3emlxf,1,response,space,472.6999999284744,466.5,472.6999999284744,472.6999999284744,466.5,472.6999999284744,1,472.6999999284744,0,0,,Keyboard Response,keyboard response,2,object-21,passages,,,1,0,Passage 1,0,Easy,2,2,,,,,,,,,,,,
12,1716654824674,25/05/2024 16:33:44,1716658424674,1,25/05/2024 18:33:44,179131,9,task-353c,,37857916,,11148998,,complete,,,computer,Desktop or Laptop,Windows 10,Edge 125.0.0.0,1536x864,1528x742,Consent,,0,Mind wandering task,11,Set2,Consent,Over 18,set2,set2,2,passages,Sentences,3emlxf,1,response,space,360.6999999284744,350.2000000000007,360.6999999284744,360.6999999284744,350.2000000000007,360.6999999284744,1,360.6999999284744,0,0,,Keyboard Response,keyboard response,2,object-21,passages,,,1,1,Elizabeth Barrett was wise enough to see that Browning was a fine poet.,0,Easy,2,2,,,,,,,,,,,,
13,1716654825031,25/05/2024 16:33:45,1716658425031,1,25/05/2024 18:33:45,179131,9,task-353c,,37857916,,11148998,,complete,,,computer,Desktop or Laptop,Windows 10,Edge 125.0.0.0,1536x864,1528x742,Consent,,0,Mind wandering task,11,Set2,Consent,Over 18,set2,set2,3,passages,Sentences,3emlxf,1,response,space,366,349.5,366,366,349.5,366,1,366,0,0,,Keyboard Response,keyboard response,2,object-21,passages,,,1,2,"The young man with the lemon-colored gloves and long dark hair and high-strung, restless manner who had visited her in 1846 had been moved to write to her because she had praised his poetry.",1,Easy,2,2,,,,,,,,,,,,
14,1716654826236,25/05/2024 16:33:46,1716658426236,1,25/05/2024 18:33:46,179131,9,task-353c,,37857916,,11148998,,complete,,,computer,Desktop or Laptop,Windows 10,Edge 125.0.0.0,1536x864,1528x742,Consent,,0,Mind wandering task,11,Set2,Consent,Over 18,set2,set2,1,probe,Thought probe,muxvwp,1,response,On Task,1223.0999999523156,1216.699999999999,1223.0999999523156,1223.0999999523156,1216.699999999999,1223.0999999523156,1,1223.0999999523156,0,0,,Click Response,On Task,2,object-81,probe,,,,,,,,,,,,,,,,,,,,,
15,1716654826828,25/05/2024 16:33:46,1716658426828,1,25/05/2024 18:33:46,179131,9,task-353c,,37857916,,11148998,,complete,,,computer,Desktop or Laptop,Windows 10,Edge 125.0.0.0,1536x864,1528x742,Consent,,0,Mind wandering task,11,Set2,Consent,Over 18,set2,set2,4,passages,Sentences,3emlxf,1,response,space,598.1999999046329,583.7000000000007,598.1999999046329,598.1999999046329,583.7000000000007,598.1999999046329,1,598.1999999046329,0,0,,Keyboard Response,keyboard response,2,object-21,passages,,,1,3,"She found the man even more to her liking than the verse, and it was not so very long-only the time between May, 1845 and September, 1846-before Robert Browning had stolen the poetess from the dour father who guarded her like a dragon (never wanting her to marry any man), and taken her with him to Italy and a new life.",1,Easy,2,2,,,,,,,,,,,,
16,1716654827538,25/05/2024 16:33:47,1716658427538,1,25/05/2024 18:33:47,179131,9,task-353c,,37857916,,11148998,,complete,,,computer,Desktop or Laptop,Windows 10,Edge 125.0.0.0,1536x864,1528x742,Consent,,0,Mind wandering task,11,Set2,Consent,Over 18,set2,set2,2,probe,Thought probe,muxvwp,1,response,Intentional,724.4999999046322,716.2999999999993,724.4999999046322,724.4999999046322,716.2999999999993,724.4999999046322,1,724.4999999046322,0,0,,Click Response,Intentional,3,object-82,probe,,,,,,,,,,,,,,,,,,,,,
17,1716654827916,25/05/2024 16:33:47,1716658427916,1,25/05/2024 18:33:47,179131,9,task-353c,,37857916,,11148998,,complete,,,computer,Desktop or Laptop,Windows 10,Edge 125.0.0.0,1536x864,1528x742,Consent,,0,Mind wandering task,11,Set2,Consent,Over 18,set2,set2,5,passages,Sentences,3emlxf,1,response,space,386.2999999284748,383.60000000000036,386.2999999284748,386.2999999284748,383.60000000000036,386.2999999284748,1,386.2999999284748,0,0,,Keyboard Response,keyboard response,2,object-21,passages,,,1,4,"One morning, soon after Robert and Elizabeth married; she thrust a manuscript into Robert’s pocket.",0,Easy,2,2,,,,,,,,,,,,
18,1716654828359,25/05/2024 16:33:48,1716658428359,1,25/05/2024 18:33:48,179131,9,task-353c,,37857916,,11148998,,complete,,,computer,Desktop or Laptop,Windows 10,Edge 125.0.0.0,1536x864,1528x742,Consent,,0,Mind wandering task,11,Set2,Consent,Over 18,set2,set2,6,passages,Sentences,3emlxf,1,response,space,445.7999999523163,433.10000000000036,445.7999999523163,445.7999999523163,433.10000000000036,445.7999999523163,1,445.7999999523163,0,0,,Keyboard Response,keyboard response,2,object-21,passages,,,1,5,"Then she ran up to her room, embarrassed by her action.",0,Easy,2,2,,,,,,,,,,,,
19,1716654828636,25/05/2024 16:33:48,1716658428636,1,25/05/2024 18:33:48,179131,9,task-353c,,37857916,,11148998,,complete,,,computer,Desktop or Laptop,Windows 10,Edge 125.0.0.0,1536x864,1528x742,Consent,,0,Mind wandering task,11,Set2,Consent,Over 18,set2,set2,7,passages,Sentences,3emlxf,1,response,space,289.2999999761578,283.7999999999993,289.2999999761578,289.2999999761578,283.7999999999993,289.2999999761578,1,289.2999999761578,0,0,,Keyboard Response,keyboard response,2,object-21,passages,,,1,6,The manuscript was a sonnet sequence that she had written about their courtship and their love letters.,0,Easy,2,2,,,,,,,,,,,,
20,1716654828922,25/05/2024 16:33:48,1716658428922,1,25/05/2024 18:33:48,179131,9,task-353c,,37857916,,11148998,,complete,,,computer,Desktop or Laptop,Windows 10,Edge 125.0.0.0,1536x864,1528x742,Consent,,0,Mind wandering task,11,Set2,Consent,Over 18,set2,set2,8,passages,Sentences,3emlxf,1,response,space,291.7999999284748,283.10000000000036,291.7999999284748,291.7999999284748,283.10000000000036,291.7999999284748,1,291.7999999284748,0,0,,Keyboard Response,keyboard response,2,object-21,passages,,,1,7,"Mrs. Browning never intended for these poems to be published, but Robert promptly insisted that they must be.",0,Easy,2,2,,,,,,,,,,,,
21,1716654829249,25/05/2024 16:33:49,1716658429249,1,25/05/2024 18:33:49,179131,9,task-353c,,37857916,,11148998,,complete,,,computer,Desktop or Laptop,Windows 10,Edge 125.0.0.0,1536x864,1528x742,Consent,,0,Mind wandering task,11,Set2,Consent,Over 18,set2,set2,9,passages,Sentences,3emlxf,1,response,space,336.1999999284744,333.2000000000007,336.1999999284744,336.1999999284744,333.2000000000007,336.1999999284744,1,336.1999999284744,0,0,,Keyboard Response,keyboard response,2,object-21,passages,,,1,8,He suggested calling them Sonnets from the Portuguese.,0,Easy,2,2,,,,,,,,,,,,
22,1716654829566,25/05/2024 16:33:49,1716658429566,1,25/05/2024 18:33:49,179131,9,task-353c,,37857916,,11148998,,complete,,,computer,Desktop or Laptop,Windows 10,Edge 125.0.0.0,1536x864,1528x742,Consent,,0,Mind wandering task,11,Set2,Consent,Over 18,set2,set2,10,passages,Sentences,3emlxf,1,response,space,320.09999995231556,316.89999999999964,320.09999995231556,320.09999995231556,316.89999999999964,320.09999995231556,1,320.09999995231556,0,0,,Keyboard Response,keyboard response,2,object-21,passages,,,1,9,He may have suggested this title to hide the fact that the poems were personal.,0,Easy,2,2,,,,,,,,,,,,
23,1716654829854,25/05/2024 16:33:49,1716658429854,1,25/05/2024 18:33:49,179131,9,task-353c,,37857916,,11148998,,complete,,,computer,Desktop or Laptop,Windows 10,Edge 125.0.0.0,1536x864,1528x742,Consent,,0,Mind wandering task,11,Set2,Consent,Over 18,set2,set2,11,passages,Sentences,3emlxf,1,response,space,290.59999992847406,283.5,290.59999992847406,290.59999992847406,283.5,290.59999992847406,1,290.59999992847406,0,0,,Keyboard Response,keyboard response,2,object-21,passages,,,1,10,He thought that these poems were “the finest sonnets written in our language since Shakespeare’s.”,0,Easy,2,2,,,,,,,,,,,,
24,1716654830152,25/05/2024 16:33:50,1716658430152,1,25/05/2024 18:33:50,179131,9,task-353c,,37857916,,11148998,,complete,,,computer,Desktop or Laptop,Windows 10,Edge 125.0.0.0,1536x864,1528x742,Consent,,0,Mind wandering task,11,Set2,Consent,Over 18,set2,set2,12,passages,Sentences,3emlxf,1,response,space,305.59999992847406,299.60000000000036,305.59999992847406,305.59999992847406,299.60000000000036,305.59999992847406,1,305.59999992847406,0,0,,Keyboard Response,keyboard response,2,object-21,passages,,,1,11,"Robert Browning’s opinion of Sonnets from the Portuguese was flattering to his wife, the same as his opinion of most of her poetry.",0,Easy,2,2,,,,,,,,,,,,
25,1716654830445,25/05/2024 16:33:50,1716658430445,1,25/05/2024 18:33:50,179131,9,task-353c,,37857916,,11148998,,complete,,,computer,Desktop or Laptop,Windows 10,Edge 125.0.0.0,1536x864,1528x742,Consent,,0,Mind wandering task,11,Set2,Consent,Over 18,set2,set2,13,passages,Sentences,3emlxf,1,response,space,298.4999999284737,283.59999999999854,298.4999999284737,298.4999999284737,283.59999999999854,298.4999999284737,1,298.4999999284737,0,0,,Keyboard Response,keyboard response,2,object-21,passages,,,1,12,"He thought that she was a better poet than he was, and the world at that time agreed with him.",0,Easy,2,2,,,,,,,,,,,,
26,1716654830728,25/05/2024 16:33:50,1716658430728,1,25/05/2024 18:33:50,179131,9,task-353c,,37857916,,11148998,,complete,,,computer,Desktop or Laptop,Windows 10,Edge 125.0.0.0,1536x864,1528x742,Consent,,0,Mind wandering task,11,Set2,Consent,Over 18,set2,set2,14,passages,Sentences,3emlxf,1,response,space,298.09999997615887,283.3000000000011,298.09999997615887,298.09999997615887,283.3000000000011,298.09999997615887,1,298.09999997615887,0,0,,Keyboard Response,keyboard response,2,object-21,passages,,,1,13,"He called her his “moon of poets,” and she considered him her sun.",0,Easy,2,2,,,,,,,,,,,,
27,1716654831022,25/05/2024 16:33:51,1716658431022,1,25/05/2024 18:33:51,179131,9,task-353c,,37857916,,11148998,,complete,,,computer,Desktop or Laptop,Windows 10,Edge 125.0.0.0,1536x864,1528x742,Consent,,0,Mind wandering task,11,Set2,Consent,Over 18,set2,set2,15,passages,Sentences,3emlxf,1,response,space,308.89999999999964,299.89999999999964,308.89999999999964,308.89999999999964,299.89999999999964,308.89999999999964,1,308.89999999999964,0,0,,Keyboard Response,keyboard response,2,object-21,passages,,,1,14,Elizabeth Barrett Browning was a pure singer with a lovely lyrical tenderness.,0,Easy,2,2,,,,,,,,,,,,
28,1716654831312,25/05/2024 16:33:51,1716658431312,1,25/05/2024 18:33:51,179131,9,task-353c,,37857916,,11148998,,complete,,,computer,Desktop or Laptop,Windows 10,Edge 125.0.0.0,1536x864,1528x742,Consent,,0,Mind wandering task,11,Set2,Consent,Over 18,set2,set2,16,passages,Sentences,3emlxf,1,response,space,298.6999999284744,283.5,298.6999999284744,298.6999999284744,283.5,298.6999999284744,1,298.6999999284744,0,0,,Keyboard Response,keyboard response,2,object-21,passages,,,1,15,She was the best poet of her sex since Sappho.,0,Easy,2,2,,,,,,,,,,,,
29,1716654831600,25/05/2024 16:33:51,1716658431600,1,25/05/2024 18:33:51,179131,9,task-353c,,37857916,,11148998,,complete,,,computer,Desktop or Laptop,Windows 10,Edge 125.0.0.0,1536x864,1528x742,Consent,,0,Mind wandering task,11,Set2,Consent,Over 18,set2,set2,17,passages,Sentences,3emlxf,1,response,space,303.39999997615814,299.7000000000007,303.39999997615814,303.39999997615814,299.7000000000007,303.39999997615814,1,303.39999997615814,0,0,,Keyboard Response,keyboard response,2,object-21,passages,,,1,16,Her Sonnets reveal a woman’s secret soul like no other poetry in our literature up to that time.,0,Easy,2,2,,,,,,,,,,,,
30,1716654831924,25/05/2024 16:33:51,1716658431924,1,25/05/2024 18:33:51,179131,9,task-353c,,37857916,,11148998,,complete,,,computer,Desktop or Laptop,Windows 10,Edge 125.0.0.0,1536x864,1528x742,Consent,,0,Mind wandering task,11,Set2,Consent,Over 18,set2,set2,18,passages,Sentences,3emlxf,1,response,space,327.39999990463184,317,327.39999990463184,327.39999990463184,317,327.39999990463184,1,327.39999990463184,0,0,,Keyboard Response,keyboard response,2,object-21,passages,,,1,17,"They did so with autobiographical honesty, fine moderation and fullness.",0,Easy,2,2,,,,,,,,,,,,
31,1716654832170,25/05/2024 16:33:52,1716658432170,1,25/05/2024 18:33:52,179131,9,task-353c,,37857916,,11148998,,complete,,,computer,Desktop or Laptop,Windows 10,Edge 125.0.0.0,1536x864,1528x742,Consent,,0,Mind wandering task,11,Set2,Consent,Over 18,set2,set2,19,passages,Sentences,3emlxf,1,response,space,256.2999999999993,250,256.2999999999993,256.2999999999993,250,256.2999999999993,1,256.2999999999993,0,0,,Keyboard Response,keyboard response,2,object-21,passages,,,1,18,Her lyrical mastery shines in many passages of her writings.,0,Easy,2,2,,,,,,,,,,,,
32,1716654832426,25/05/2024 16:33:52,1716658432426,1,25/05/2024 18:33:52,179131,9,task-353c,,37857916,,11148998,,complete,,,computer,Desktop or Laptop,Windows 10,Edge 125.0.0.0,1536x864,1528x742,Consent,,0,Mind wandering task,11,Set2,Consent,Over 18,set2,set2,20,passages,Sentences,3emlxf,1,response,space,262.7999999999993,250.1999999999989,262.7999999999993,262.7999999999993,250.1999999999989,262.7999999999993,1,262.7999999999993,0,0,,Keyboard Response,keyboard response,2,object-21,passages,,,1,19,Italy was a kind of promised land for Elizabeth Browning.,0,Easy,2,2,,,,,,,,,,,,
33,1716654832689,25/05/2024 16:33:52,1716658432689,1,25/05/2024 18:33:52,179131,9,task-353c,,37857916,,11148998,,complete,,,computer,Desktop or Laptop,Windows 10,Edge 125.0.0.0,1536x864,1528x742,Consent,,0,Mind wandering task,11,Set2,Consent,Over 18,set2,set2,21,passages,Sentences,3emlxf,1,response,space,275.10000000000036,266.39999999999964,275.10000000000036,275.10000000000036,266.39999999999964,275.10000000000036,1,275.10000000000036,0,0,,Keyboard Response,keyboard response,2,object-21,passages,,,1,20,"In the summer, she and her husband lived in Florence or in little villages.",0,Easy,2,2,,,,,,,,,,,,
34,1716654832956,25/05/2024 16:33:52,1716658432956,1,25/05/2024 18:33:52,179131,9,task-353c,,37857916,,11148998,,complete,,,computer,Desktop or Laptop,Windows 10,Edge 125.0.0.0,1536x864,1528x742,Consent,,0,Mind wandering task,11,Set2,Consent,Over 18,set2,set2,22,passages,Sentences,3emlxf,1,response,space,275.7999999046333,266.6000000000022,275.7999999046333,275.7999999046333,266.6000000000022,275.7999999046333,1,275.7999999046333,0,0,,Keyboard Response,keyboard response,2,object-21,passages,,,1,21,She drank in the sun of the south and the warmth of her husband’s love.,0,Easy,2,2,,,,,,,,,,,,
35,1716654833223,25/05/2024 16:33:53,1716658433223,1,25/05/2024 18:33:53,179131,9,task-353c,,37857916,,11148998,,complete,,,computer,Desktop or Laptop,Windows 10,Edge 125.0.0.0,1536x864,1528x742,Consent,,0,Mind wandering task,11,Set2,Consent,Over 18,set2,set2,23,passages,Sentences,3emlxf,1,response,space,275.9999999761567,266.5,275.9999999761567,275.9999999761567,266.5,275.9999999761567,1,275.9999999761567,0,0,,Keyboard Response,keyboard response,2,object-21,passages,,,1,22,She blossomed in a life of delicate happiness for fifteen years.,0,Easy,2,2,,,,,,,,,,,,
36,1716654833499,25/05/2024 16:33:53,1716658433499,1,25/05/2024 18:33:53,179131,9,task-353c,,37857916,,11148998,,complete,,,computer,Desktop or Laptop,Windows 10,Edge 125.0.0.0,1536x864,1528x742,Consent,,0,Mind wandering task,11,Set2,Consent,Over 18,set2,set2,24,passages,Sentences,3emlxf,1,response,space,285.89999995231483,283.3999999999978,285.89999995231483,285.89999995231483,283.3999999999978,285.89999995231483,1,285.89999995231483,0,0,,Keyboard Response,keyboard response,2,object-21,passages,,,1,23,"She found friends in Italy, most of them cultured Americans.",0,Easy,2,2,,,,,,,,,,,,
37,1716654833763,25/05/2024 16:33:53,1716658433763,1,25/05/2024 18:33:53,179131,9,task-353c,,37857916,,11148998,,complete,,,computer,Desktop or Laptop,Windows 10,Edge 125.0.0.0,1536x864,1528x742,Consent,,0,Mind wandering task,11,Set2,Consent,Over 18,set2,set2,25,passages,Sentences,3emlxf,1,response,space,266.59999997615887,250.20000000000073,266.59999997615887,266.59999997615887,250.20000000000073,266.59999997615887,1,266.59999997615887,0,0,,Keyboard Response,keyboard response,2,object-21,passages,,,1,24,Hawthorne saw the Browning's there: the New England thinker and essayist Margaret Fuller visited them.,1,Easy,2,2,,,,,,,,,,,,
38,1716654834798,25/05/2024 16:33:54,1716658434798,1,25/05/2024 18:33:54,179131,9,task-353c,,37857916,,11148998,,complete,,,computer,Desktop or Laptop,Windows 10,Edge 125.0.0.0,1536x864,1528x742,Consent,,0,Mind wandering task,11,Set2,Consent,Over 18,set2,set2,3,probe,Thought probe,muxvwp,1,response,Unintentional,1051.7999999523163,1049.7000000000007,1051.7999999523163,1051.7999999523163,1049.7000000000007,1051.7999999523163,1,1051.7999999523163,0,0,,Click Response,Unintentional,4,object-84,probe,,,,,,,,,,,,,,,,,,,,,
